category,product_name,product_title,product_description,product_price,product_image1,product_image2,product_image3,product_image4,
,"TEmkin Otoscope with LED,","TEmkin Otoscope with LED, Professional Veterinarian Ear Scope Sets, Pet Dog Cat Otoscopes, Comes with Ear Accessories in 4 Sizes, Suitable for Pets of Different Sizes","a professional-grade diagnostic tool for examining the ear, featuring a bright LED light, high-quality optics, and a compact, portable design. It is used to visualize the ear canal and eardrum, helping to identify issues like wax buildup or infections, and typically comes with a set of reusable specula (ear tips) of various sizes to fit different ear canals. The ergonomic handle with a textured grip provides comfort and control for both healthcare professionals and home use. 
Key features
LED illumination: Provides clear, bright light to illuminate the ear canal and tympanic membrane.
High-quality optics: Includes a magnifying lens for clear, detailed visualization and accurate assessment.
Compact and portable: Designed for easy transport and use in various settings, including mobile clinics and home visits.
Multiple specula: Comes with several reusable ear tips of different sizes to accommodate both children and adults.
Ergonomic design: Features a comfortable, textured grip for precise control during examinations.
Battery-operated: Powered by standard batteries (often AAA), ensuring consistent lighting without special equipment. 
Mini Otoscope for Ear Inspection – Compact LED ... - Enablemart
Designed as a product for deaf care and hearing maintenance, the mini otoscope plays a vital role in the early detection of ear in...

Enablemart

Healthcare Professional Mini Otoscope with LED Light Enhanced ...
Product description This professional-grade mini otoscope is an essential diagnostic tool for thorough ear examinations. The devic...

Amazon.in

LED Otoscope with White Light, Pocket-Size Scope, Includes Black ...
The bright LED white light ensures clear, distortion-free visibility, making it easier to examine the ear canal and eardrum for an...

Amazon.in

Show all",,https://www.amazon.de/-/en/Professional-Veterinarian-Otoscopes-Accessories-Different/dp/B0CG2XG5PS#,https://share.google/images/ynhubxNsoKDgMerQP,https://share.google/images/PHI7K3VL9bpwX2MwB,https://www.google.com/url?sa=i&url=https%3A%2F%2Fwww.amazon.de%2F-%2Fen%2FProfessional-Veterinarian-Otoscopes-Accessories-Different%2Fdp%2FB0CG2XG5PS&psig=AOvVaw3-zisIW5_0CP58Znx0-Tjb&ust=1764653561108000&source=images&cd=vfe&opi=89978449&ved=0CBUQjRxqFwoTCNj784TVm5EDFQAAAAAdAAAAABAE,
,Makeup Mirror with LED Light,,"This LED makeup mirror features three light color modes and stepless dimming to give you perfect illumination for makeup or grooming. Its slim, foldable design makes it easy to carry and place anywhere, while the touch-control LED lighting ensures a clear, bright, and customizable reflection. Ideal for home use, travel, or a quick touch-up on the go.",,https://share.google/images/OcpLpcLUmlX66H7B1,https://share.google/images/5wigmp7oMSn2vwaQP,https://share.google/images/8Cs84GkwgBqUSrUQE,,
,Hair Dye Stick - for Gray Hair Coverage - 2-in-1,Hair Dye Stick - for Gray Hair Coverage - 2-in-1 Antiperspirant Applicator with Comb and Portable Dye Stick for Home Use - Men and Women,"Scalp Solutions Applicator, also known as a hair oil or liquid guide comb applicator. This device is designed to apply hair serums, oils, or other treatments directly to the scalp and hair roots, often including a massage function. 
Function: It allows for the precise introduction of liquid into the hair roots without manual application, often featuring rolling ball teeth to help with absorption and blood circulation. 
Material: These applicators are typically made of lightweight, washable plastic. 
Availability: Similar products are widely available for purchase online from various retailers. 
Purpose: They are used for hair treatments, growth solutions, and general scalp care. ",,https://www.amazon.com.br/Bast%C3%A3o-Tinta-Para-Cabelo-Antitranspirante/dp/B0F9FG8T75#,https://www.amazon.com.br/Bast%C3%A3o-Tinta-Para-Cabelo-Antitranspirante/dp/B0F9FG8T75#,https://www.amazon.com.br/Bast%C3%A3o-Tinta-Para-Cabelo-Antitranspirante/dp/B0F9FG8T75#,https://www.amazon.com.br/Bast%C3%A3o-Tinta-Para-Cabelo-Antitranspirante/dp/B0F9FG8T75#,
,,Joseph Joseph Caddy Tower Slimline Sink Tidy,"The Joseph Joseph Caddy Tower Slimline Sink Tidy is a compact and stylish organiser designed to keep your sink area neat and clutter-free. Its slim profile fits perfectly in narrow spaces, especially between the sink and the wall. Featuring dedicated sections for washing-up liquid bottles, brushes, and sponges, it helps maintain an organised cleaning setup. The integrated drainage spout directs excess water back into the sink to keep surfaces dry and hygienic. The entire unit can be fully dismantled, making deep cleaning simple and hassle-free. Ideal for modern kitchens that need smart space-saving solutions.",,https://altvibes.com/cdn/shop/products/JJ_Caddy_20tower_20slimeline_20sink_20tidy_green_85124_20_1.jpg?v=1753696530,https://share.google/images/LXbPldemrJlGBLa4q,,,
,,Clay Craft Fine Tableware Coffee Mugs. ,"Clay Craft Fine Tableware Coffee Mugs. The box indicates it is a set of six mugs with a vibrant, tropical floral design. 
Key product information: 
Brand: Clay Craft
Product Type: Coffee mugs (set of 6)
Material: Ceramic
Features: Often chip resistant, scratch resistant, high gloss, lead and cadmium free, and microwave/dishwasher safe (specifics may vary by model)
Availability: Products from this brand are available from various online retailers and stores in India",, https://share.google/images/bIqsI0WpHI8p9AB1m,,,,
,,USB-powered duck-shaped humidifier. ,"USB-powered duck-shaped humidifier. 
This is a portable, compact device designed to increase moisture in the air.
It operates via a USB power supply.
The product is labeled as ""No. 1"" and features a super atomization function (超霧化加湿器).
It is designed for personal use, likely in a small space like a desk or car.",,,,,,
,,"Vintage Style Antique Brass Fish Shaped Lock with 2 Keys, Brass Fish Padlock with 2 Keys for Home/Office Decor/Security and Gifting","set of traditional, handcrafted brass fish-shaped padlocks. These items are functional locks but also commonly used as decorative pieces or collectible items, often associated with Indian craftsmanship. 
Here is some shopping information:
The padlocks are typically made from solid brass, sometimes with an iron shackle. 
They are a genuine Indian work of art, produced using traditional sand-casting techniques by artisans in India. 
The locks are often described as ""tricky"" or ""magic"" locks because they require a specific action (like pressing the fish's eye after turning the key) to open. 
They are available from various online retailers and can be found in different sizes and designs. ",,https://share.google/images/6JyK8WgMiIVJmqx2g,https://share.google/images/KAumMD0fUmmo3bGti,https://share.google/images/BBAhIa2QlA7oIQmBU,,
,,Photostable sunscreen and Bristaa,"Photostable sunscreen and Bristaa Intense cream.
Photostable is a dermatologist-recommended sunscreen line, often available as an emulgel or gel, providing high SPF (e.g., SPF 55+) and broad-spectrum UVA/UVB protection. It is formulated for various skin types, including oily and acne-prone skin, and is known for its non-greasy, matte finish with no white cast. 
Bristaa Intense is a steroid-free skin brightening cream designed to even out skin tone and reduce dark spots. It contains moisturizers and natural extracts to hydrate and nourish the skin, aiming for a more radiant complexion. 
These products are available for purchase from various online and physical pharmacies and retailers. 
The products are manufactured under the Sun Pharma brand. ",,https://www.amazon.in/Photostable-Tube-50g-Insta-Sunscreen/dp/B09ZDHM8DP#,https://share.google/images/B6kt6VNBN6l26lso6,https://www.amazon.in/Photostable-Tube-50g-Insta-Sunscreen/dp/B09ZDHM8DP#,,
,,Silicone Water Bottle-1 Litre Motivational,"a motivational water bottle with time and capacity markers. These bottles are designed to help track daily water intake and encourage hydration. 
Key product information:
Capacity: Typically 1000 mL (approximately 32 oz). 
Material: Often made from BPA-free, durable plastic like Tritan. 
Features: Includes time markers (e.g., from 4 am to 10 am) and measurements in both milliliters (mL) and ounces (OZ). 
Design: Features a secure, leak-proof lid, a sturdy wrist strap, and a gradient color design. 
Availability: Widely available online from various brands and retailers. ",,https://www.amazon.in/ZUDELLA-Silicone-Motivational-Marker-Leak-Multicolor/dp/B0D4J3YZ2H/ref=asc_df_B0D4J3YZ2H?mcid=584e0b9f2cdc38869cafd0cea240a6fc&tag=googleshopmob-21&linkCode=df0&hvadid=709916724466&hvpos=&hvnetw=g&hvrand=154708809278354475&hvpone=&hvptwo=&hvqmt=&hvdev=m&hvdvcmdl=&hvlocint=&hvlocphy=9062280&hvtargid=pla-2311282350391&psc=1&gad_source=1#,https://www.amazon.in/ZUDELLA-Silicone-Motivational-Marker-Leak-Multicolor/dp/B0D4J3YZ2H/ref=asc_df_B0D4J3YZ2H?mcid=584e0b9f2cdc38869cafd0cea240a6fc&tag=googleshopmob-21&linkCode=df0&hvadid=709916724466&hvpos=&hvnetw=g&hvrand=154708809278354475&hvpone=&hvptwo=&hvqmt=&hvdev=m&hvdvcmdl=&hvlocint=&hvlocphy=9062280&hvtargid=pla-2311282350391&psc=1&gad_source=1#,,https://www.amazon.in/ZUDELLA-Silicone-Motivational-Marker-Leak-Multicolor/dp/B0D4J3YZ2H/ref=asc_df_B0D4J3YZ2H?mcid=584e0b9f2cdc38869cafd0cea240a6fc&tag=googleshopmob-21&linkCode=df0&hvadid=709916724466&hvpos=&hvnetw=g&hvrand=154708809278354475&hvpone=&hvptwo=&hvqmt=&hvdev=m&hvdvcmdl=&hvlocint=&hvlocphy=9062280&hvtargid=pla-2311282350391&psc=1&gad_source=1#,https://www.amazon.in/ZUDELLA-Silicone-Motivational-Marker-Leak-Multicolor/dp/B0D4J3YZ2H/ref=asc_df_B0D4J3YZ2H?mcid=584e0b9f2cdc38869cafd0cea240a6fc&tag=googleshopmob-21&linkCode=df0&hvadid=709916724466&hvpos=&hvnetw=g&hvrand=154708809278354475&hvpone=&hvptwo=&hvqmt=&hvdev=m&hvdvcmdl=&hvlocint=&hvlocphy=9062280&hvtargid=pla-2311282350391&psc=1&gad_source=1#
,,Zolsoma tablets,"Zolsoma tablets, which is a combination medicine containing Zolpidem 5/10 mg and Melatonin 3 mg. It is used in the treatment of insomnia (difficulty falling or staying asleep). 
Active Ingredients: Zolpidem and Melatonin. 
Purpose: Helps treat insomnia by regulating the sleep-wake cycle and promoting sleep. 
Mechanism: Zolpidem is a sedative that slows nerve activity in the brain, while melatonin is a natural hormone that helps maintain the sleep cycle. 
Availability: This product appears to be available for purchase online from various pharmacies. ",,https://share.google/images/2RRWQDEMzha0jJ4oW,,,,
,,5-in-1 derma roller kit,"5-in-1 derma roller kit, a microneedling tool used for facial and body care.      This kit typically includes multiple interchangeable roller heads with different needle counts and lengths for various skin areas.  The microneedles are often made of titanium.  It is designed to enhance serum absorption, promote collagen production, and help with issues like wrinkles, stretch marks, and acne scars.  Product dimensions are approximately \(15\times 12\times 8\) cm. ",,https://www.amazon.in/KOIME-Derma-Roller-Microneedling-Microdermabrasion/dp/B0DGTC9VDN#,https://www.amazon.in/KOIME-Derma-Roller-Microneedling-Microdermabrasion/dp/B0DGTC9VDN#,https://www.amazon.in/KOIME-Derma-Roller-Microneedling-Microdermabrasion/dp/B0DGTC9VDN#,https://www.amazon.in/KOIME-Derma-Roller-Microneedling-Microdermabrasion/dp/B0DGTC9VDN#,https://www.amazon.in/KOIME-Derma-Roller-Microneedling-Microdermabrasion/dp/B0DGTC9VDN#
,,Acne-OC Gel,"Acne-OC Gel, a therapeutic sebum regulating moisturizer manufactured by Ipca Laboratories Ltd. 
It is designed for use on acne-prone skin and as part of acne management procedures. 
The product comes in a 75g pack size. 
It is formulated with natural phytoactive complexes and helps hydrate the skin while controlling excess oil production. 
The approximate price is around ₹588, but this may vary by retailer. ",,https://www.amazon.in/ACNE-OC-Moisturiser-Oily-Acne-Prone-Skin/dp/B0F8W3FHF1#,https://www.amazon.in/ACNE-OC-Moisturiser-Oily-Acne-Prone-Skin/dp/B0F8W3FHF1#,https://www.amazon.in/ACNE-OC-Moisturiser-Oily-Acne-Prone-Skin/dp/B0F8W3FHF1#,https://www.amazon.in/ACNE-OC-Moisturiser-Oily-Acne-Prone-Skin/dp/B0F8W3FHF1#,https://www.amazon.in/ACNE-OC-Moisturiser-Oily-Acne-Prone-Skin/dp/B0F8W3FHF1#
,,foldable Bluetooth keyboard.,"foldable Bluetooth keyboard. 
This type of keyboard is designed to be highly portable due to its bi-fold or tri-fold design, allowing it to be easily slipped into a bag or pocket. 
It uses Bluetooth connectivity (often Bluetooth 5.0 or 5.1) to pair wirelessly with devices such as smartphones, tablets, and laptops, typically with an effective range of around 10 meters. 
Many models feature a built-in touchpad that supports multi-touch gestures, acting as a mouse for easier navigation. 
Compatibility is universal, working across various operating systems including iOS, Android, and Windows devices. 
These keyboards are generally rechargeable, offering long battery life with significant standby time. ",,https://www.amazon.in/Wireless-Keyboard-Bluetooth-Continuous-Aluminum/dp/B07ZR373RJ#,https://www.amazon.in/Wireless-Keyboard-Bluetooth-Continuous-Aluminum/dp/B07ZR373RJ#,https://www.amazon.in/Wireless-Keyboard-Bluetooth-Continuous-Aluminum/dp/B07ZR373RJ#,https://www.amazon.in/Wireless-Keyboard-Bluetooth-Continuous-Aluminum/dp/B07ZR373RJ#,
,,Loceryl medicated nail lacquer,"Loceryl medicated nail lacquer. This is an antifungal medication used to treat fungal nail infections, sponsored by Galderma. 
Active Ingredient: Contains 5% w/v Amorolfine. 
Application: Typically applied once weekly to affected fingernails or toenails. 
Availability: It is a prescription medication available for purchase online and in pharmacies. 
Packaging: Available in different sizes, such as 2.5 ml and 5 ml bottles. ",,https://share.google/images/BTLVT6Tfhlr8ShQ1f,,,,
,,Smart Frog,"a ""Smart Frog"" branded electronic device, which appears to be a portable air purifier, aroma diffuser, or insect killer. 
The product is marketed as a 4-in-1 device for use in cars or small rooms, featuring an ionizer, photocatalysis, UV lamp, and anion release capability. 
Other variations of ""Smart Frog"" devices include electric insect killers that use UV light trapping. 
The device is designed for low power consumption and is easy to clean. 
It is available for purchase from online retailers such as Amazon and Flipkart. ",,https://share.google/images/9XSKhKnyJVE6wadSp,https://share.google/images/UsZwzj1GFD2UmhIOR,https://share.google/images/M2lUA7djGnQeNtJB9,,
,,Bosch AquaSurf 250 Patio Cleaner attachment,"Bosch AquaSurf 250 Patio Cleaner attachment. This accessory is designed for use with compatible Bosch pressure washers to rapidly clean small to medium-sized patios and driveways. 
Key shopping information:
The cleaner has a 250 mm wide cleaning head, which is approximately 20% larger than its predecessor, allowing for efficient cleaning of about one square meter per minute. 
It features a pivoting joint for easy maneuvering across various surfaces like stone, decking, and brickwork. 
A brush skirt is included to act as a splash guard, keeping the surrounding area dry during use. 
It is compatible with several Bosch pressure washer models, including EasyAquatak 100LL/110/120, UniversalAquatak, AQT 33-10, AQT 33-11, AQT 35-12, AQT 37-13, AQT 40-13, and AQT 42-13. 
The product is available for purchase from various retailers, including online platforms like Amazon, Flipkart, and Tata CLiQ. ",,https://share.google/images/e3BL9G269IUDi8L5I,https://www.amazon.in/Bosch-AquaSurf-Cleaner-F016800421-Priming/dp/B0BRG9G53P#,https://www.amazon.in/Bosch-AquaSurf-Cleaner-F016800421-Priming/dp/B0BRG9G53P#,,
,,a single-use hypodermic syringe made by Dispo Van,"a single-use hypodermic syringe made by Dispo Van.
Brand: Dispo Van
Type: Single use hypodermic syringe
Packaging: Ribbon Pack
Purpose: Used for medical injections or fluid withdrawal.",,https://share.google/images/OHsIvDKbiNv2cYzPC,,https://share.google/images/vAALaTeMNqILyu9mh,,
,,TH-8016 portable handheld LED lighted magnifying glass with a scale. ,"TH-8016 portable handheld LED lighted magnifying glass with a scale. 
It offers adjustable magnification options of 10X, 15X, and 20X. 
The integrated scale allows for measuring the size of items. 
It is equipped with an inbuilt light source (LED and UV lamp) for use in low-light situations or for specific applications like jewelry appraisal and banknote detection. 
The device is designed to be durable and resilient for regular use. ",,https://share.google/images/EUCPncTfrbfklnEB1,https://share.google/images/isgxKGyMBM93xOguA,,,
,,"small, water-powered analog clock, sold by Emax Traders. ","small, water-powered analog clock, sold by Emax Traders. 
Technology: It uses water to power the mechanism, a modern application of an ancient time-measuring device called a clepsydra. 
Dimensions: The product is approximately 16x12x7cm. 
Availability: It is available in Mumbai from Emax Traders. 
Price: It has an approximate price of 550.00 INR. ",,https://share.google/images/YBSRABVjhHENvOBOU,https://share.google/images/At0MiZAyInxSGBsRN,,,